{
  "version": 1,
  "fps": 30,
  "introDuration": 3,
  "scenes": [
    {
      "id": "scene-1",
      "duration": 9.4,
      "words": [
        {
          "text": "\"",
          "start": 0,
          "end": 0.204545
        },
        {
          "text": "KYC",
          "start": 0.204545,
          "end": 0.818181
        },
        {
          "text": "又",
          "start": 0.818181,
          "end": 1.022726
        },
        {
          "text": "被",
          "start": 1.022726,
          "end": 1.227271
        },
        {
          "text": "拒",
          "start": 1.227271,
          "end": 1.431816
        },
        {
          "text": "了",
          "start": 1.431816,
          "end": 1.636361
        },
        {
          "text": "，",
          "start": 1.636361,
          "end": 1.840906
        },
        {
          "text": "到底",
          "start": 1.840906,
          "end": 2.249997
        },
        {
          "text": "哪里",
          "start": 2.249997,
          "end": 2.659088
        },
        {
          "text": "不对",
          "start": 2.659088,
          "end": 3.068179
        },
        {
          "text": "？",
          "start": 3.068179,
          "end": 3.272724
        },
        {
          "text": "\"",
          "start": 3.272724,
          "end": 3.477269
        },
        {
          "text": "其实",
          "start": 3.477269,
          "end": 3.88636
        },
        {
          "text": "大",
          "start": 3.88636,
          "end": 4.090905
        },
        {
          "text": "多数",
          "start": 4.090905,
          "end": 4.499996
        },
        {
          "text": "失败",
          "start": 4.499996,
          "end": 4.909087
        },
        {
          "text": "，",
          "start": 4.909087,
          "end": 5.113632
        },
        {
          "text": "原因",
          "start": 5.113632,
          "end": 5.522723
        },
        {
          "text": "就",
          "start": 5.522723,
          "end": 5.727268
        },
        {
          "text": "那几个",
          "start": 5.727268,
          "end": 6.340904
        },
        {
          "text": "。",
          "start": 6.340904,
          "end": 6.545449
        },
        {
          "text": "先讲",
          "start": 6.545449,
          "end": 6.95454
        },
        {
          "text": "清楚",
          "start": 6.95454,
          "end": 7.363631
        },
        {
          "text": "为什么",
          "start": 7.363631,
          "end": 7.977267
        },
        {
          "text": "要",
          "start": 7.977267,
          "end": 8.181812
        },
        {
          "text": "KYC",
          "start": 8.181812,
          "end": 8.795448
        },
        {
          "text": "。",
          "start": 8.795448,
          "end": 9
        }
      ]
    },
    {
      "id": "scene-2",
      "duration": 11.4,
      "words": [
        {
          "text": "KYC",
          "start": 0,
          "end": 0.66
        },
        {
          "text": "的",
          "start": 0.66,
          "end": 0.88
        },
        {
          "text": "意思",
          "start": 0.88,
          "end": 1.32
        },
        {
          "text": "就是",
          "start": 1.32,
          "end": 1.76
        },
        {
          "text": "\"",
          "start": 1.76,
          "end": 1.98
        },
        {
          "text": "了解",
          "start": 1.98,
          "end": 2.42
        },
        {
          "text": "你的",
          "start": 2.42,
          "end": 2.86
        },
        {
          "text": "客户",
          "start": 2.86,
          "end": 3.3
        },
        {
          "text": "\"",
          "start": 3.3,
          "end": 3.52
        },
        {
          "text": "。",
          "start": 3.52,
          "end": 3.74
        },
        {
          "text": "正规",
          "start": 3.74,
          "end": 4.18
        },
        {
          "text": "平台",
          "start": 4.18,
          "end": 4.62
        },
        {
          "text": "按",
          "start": 4.62,
          "end": 4.84
        },
        {
          "text": "反",
          "start": 4.84,
          "end": 5.06
        },
        {
          "text": "洗钱",
          "start": 5.06,
          "end": 5.5
        },
        {
          "text": "规则",
          "start": 5.5,
          "end": 5.94
        },
        {
          "text": "，",
          "start": 5.94,
          "end": 6.16
        },
        {
          "text": "必须",
          "start": 6.16,
          "end": 6.6
        },
        {
          "text": "核实",
          "start": 6.6,
          "end": 7.04
        },
        {
          "text": "用户",
          "start": 7.04,
          "end": 7.48
        },
        {
          "text": "身份",
          "start": 7.48,
          "end": 7.92
        },
        {
          "text": "。",
          "start": 7.92,
          "end": 8.14
        },
        {
          "text": "没有",
          "start": 8.14,
          "end": 8.58
        },
        {
          "text": "正规",
          "start": 8.58,
          "end": 9.02
        },
        {
          "text": "平台",
          "start": 9.02,
          "end": 9.46
        },
        {
          "text": "能",
          "start": 9.46,
          "end": 9.68
        },
        {
          "text": "绕",
          "start": 9.68,
          "end": 9.9
        },
        {
          "text": "开",
          "start": 9.9,
          "end": 10.12
        },
        {
          "text": "这",
          "start": 10.12,
          "end": 10.34
        },
        {
          "text": "一步",
          "start": 10.34,
          "end": 10.78
        },
        {
          "text": "。",
          "start": 10.78,
          "end": 11
        }
      ]
    },
    {
      "id": "scene-3",
      "duration": 10.4,
      "words": [
        {
          "text": "开始",
          "start": 0,
          "end": 0.4
        },
        {
          "text": "前",
          "start": 0.4,
          "end": 0.6
        },
        {
          "text": "先",
          "start": 0.6,
          "end": 0.8
        },
        {
          "text": "准备",
          "start": 0.8,
          "end": 1.2
        },
        {
          "text": "好",
          "start": 1.2,
          "end": 1.4
        },
        {
          "text": "：",
          "start": 1.4,
          "end": 1.6
        },
        {
          "text": "本人",
          "start": 1.6,
          "end": 2
        },
        {
          "text": "有效",
          "start": 2,
          "end": 2.4
        },
        {
          "text": "的",
          "start": 2.4,
          "end": 2.6
        },
        {
          "text": "政府",
          "start": 2.6,
          "end": 3
        },
        {
          "text": "证件",
          "start": 3,
          "end": 3.4
        },
        {
          "text": "，",
          "start": 3.4,
          "end": 3.6
        },
        {
          "text": "比如",
          "start": 3.6,
          "end": 4
        },
        {
          "text": "护照",
          "start": 4,
          "end": 4.4
        },
        {
          "text": "或",
          "start": 4.4,
          "end": 4.6
        },
        {
          "text": "身份",
          "start": 4.6,
          "end": 5
        },
        {
          "text": "证",
          "start": 5,
          "end": 5.2
        },
        {
          "text": "。",
          "start": 5.2,
          "end": 5.4
        },
        {
          "text": "确认",
          "start": 5.4,
          "end": 5.8
        },
        {
          "text": "年",
          "start": 5.8,
          "end": 6
        },
        {
          "text": "满",
          "start": 6,
          "end": 6.2
        },
        {
          "text": "18",
          "start": 6.2,
          "end": 6.6
        },
        {
          "text": "岁",
          "start": 6.6,
          "end": 6.8
        },
        {
          "text": "。",
          "start": 6.8,
          "end": 7
        },
        {
          "text": "找个",
          "start": 7,
          "end": 7.4
        },
        {
          "text": "网络",
          "start": 7.4,
          "end": 7.8
        },
        {
          "text": "稳定",
          "start": 7.8,
          "end": 8.2
        },
        {
          "text": "、",
          "start": 8.2,
          "end": 8.4
        },
        {
          "text": "光线",
          "start": 8.4,
          "end": 8.8
        },
        {
          "text": "充足",
          "start": 8.8,
          "end": 9.2
        },
        {
          "text": "的",
          "start": 9.2,
          "end": 9.4
        },
        {
          "text": "地方",
          "start": 9.4,
          "end": 9.8
        },
        {
          "text": "。",
          "start": 9.8,
          "end": 10
        }
      ]
    },
    {
      "id": "scene-4",
      "duration": 11.4,
      "words": [
        {
          "text": "常见",
          "start": 0,
          "end": 0.44898
        },
        {
          "text": "失败",
          "start": 0.44898,
          "end": 0.89796
        },
        {
          "text": "第",
          "start": 0.89796,
          "end": 1.12245
        },
        {
          "text": "一种",
          "start": 1.12245,
          "end": 1.57143
        },
        {
          "text": "：",
          "start": 1.57143,
          "end": 1.79592
        },
        {
          "text": "证件",
          "start": 1.79592,
          "end": 2.2449
        },
        {
          "text": "过期",
          "start": 2.2449,
          "end": 2.69388
        },
        {
          "text": "，",
          "start": 2.69388,
          "end": 2.91837
        },
        {
          "text": "或者",
          "start": 2.91837,
          "end": 3.36735
        },
        {
          "text": "平台",
          "start": 3.36735,
          "end": 3.81633
        },
        {
          "text": "不",
          "start": 3.81633,
          "end": 4.04082
        },
        {
          "text": "支持",
          "start": 4.04082,
          "end": 4.4898
        },
        {